{
  "schemaVersion": 1,
  "runId": "2026-10-20-1",
  "date": "2026-10-20",
  "producer": "newsStoryRecord@0.2.0",
  "startedAt": "2026-10-21T05:45:01.200Z",
  "finishedAt": "2026-10-21T05:45:19.800Z",
  "status": "ok",
  "inputs": {
    "archiveDay": "present",
    "todayArchive": "missing"
  },
  "counts": {
    "entry": 41,
    "story_born": 6,
    "forecast_drawn": 12,
    "verdict": 0,
    "correction": 0,
    "story_merged": 0,
    "run": 1
  },
  "daysWritten": [
    "2026-10-20",
    "2026-10-21"
  ],
  "failures": [],
  "notes": ""
}
